[
  {
    "body": {
      "content": "cod-about.md",
      "format": "md"
    },
    "short_description": {
      "content": "The CERN Open Data portal is the access point to a growing range of data produced through the research performed at CERN. It disseminates the preserved output from various research activities, including accompanying software and documentation which is needed to understand and analyse the data being shared."
    },
    "slug": "about",
    "tags": ["Getting Started"],
    "title": "CERN Open Data Portal",
    "type": {
      "primary": "Documentation",
      "secondary": ["About"]
    }
  }
]
