[
  {
    "body": {
      "content": "cod-terms-of-use.md",
      "format": "md"
    },
    "short_description": {
      "content": "The CERN Open Data Portal is offered by CERN as part of its mission to publish the results of its experimental and theoretical work."
    },
    "slug": "terms-of-use",
    "title": "CERN Open Data Terms of Use",
    "type": {
      "primary": "Documentation",
      "secondary": ["About"]
    }
  }
]
