[
  {
    "body": {
      "content": "simulated-dataset-categories.md",
      "format": "md"
    },
    "short_description": {
      "content": "Description of the simulated dataset categories used in the CERN Open Data Portal."
    },
    "slug": "simulated-dataset-categories",
    "tags": ["Getting Started"],
    "title": "Simulated Dataset Categories",
    "type": {
      "primary": "Documentation",
      "secondary": ["Guide"]
    }
  }
]
