[
  {
    "author": "CERN",
    "body": {
      "content": "cern-open-data-policy-for-lhc-experiments.md",
      "format": "md"
    },
    "date_published": "2020-12-11",
    "experiment": ["ALICE", "ATLAS", "CMS", "LHCb"],
    "short_description": {
      "content": "CERN Open Data Policy for the LHC Experiments"
    },
    "slug": "cern-open-data-policy-for-lhc-experiments",
    "title": "CERN Open Data Policy for the LHC Experiments",
    "type": {
      "primary": "News"
    }
  }
]
