[
  {
    "body": {
      "content": "cod-privacy-policy.md",
      "format": "md"
    },
    "short_description": {
      "content": "CERN does not track, collect or retain personal information from users of CERN Open Data Portal, except as otherwise provided herein. In order to enhance CERN Open Data Portal and monitor traffic, information..."
    },
    "slug": "privacy-policy",
    "title": "CERN Open Data Privacy Policy",
    "type": {
      "primary": "Documentation",
      "secondary": [
        "Policy"
      ]
    }
  }
]
